{
  "schema_version": 1,
  "id": "billing.entitlement",
  "name": "Subscription entitlement gate",
  "domain": "billing",
  "status": "CANDIDATE",
  "disposition": "EXTRACT",
  "summary": "Fail-closed allow when local subscription projection status is in an explicit list.",
  "use_when": [
    "Gate MCP or tenant provision on paid status."
  ],
  "non_goals": [
    "Grace policy",
    "Stripe API"
  ],
  "proposed_guarantees": [
    "Default active/trialing allow-list",
    "Redirect never treated as paid"
  ],
  "failure_modes": [
    "Missing customer binding",
    "past_due without explicit allow"
  ],
  "evidence": [
    {
      "visibility": "PUBLIC",
      "basis": "Original public AMSL; contract tests only; no live AWS/Stripe apply claimed.",
      "verification": "PUBLICLY_REPRODUCIBLE",
      "url": "https://github.com/ajent-social/go/tree/e4ee7567048ded41fde8c19b678db8958e142c61/billing/entitlement"
    }
  ],
  "alternatives": [
    {
      "name": "Product-local helpers",
      "url": "https://github.com/ajent-social/capabilities",
      "assessment": "Prefer AMSL when multiple products share the seam."
    }
  ],
  "implementations": [
    {
      "url": "https://github.com/ajent-social/go/tree/e4ee7567048ded41fde8c19b678db8958e142c61/billing/entitlement",
      "revision": "e4ee7567048ded41fde8c19b678db8958e142c61"
    }
  ],
  "verification": [
    {
      "kind": "CONTRACT_TEST",
      "result": "PASS",
      "evidence_url": "https://github.com/ajent-social/go/blob/e4ee7567048ded41fde8c19b678db8958e142c61/docs/billing-entitlement.md"
    },
    {
      "kind": "SECURITY_TEST",
      "result": "NOT_RUN",
      "evidence_url": "https://github.com/ajent-social/go/blob/e4ee7567048ded41fde8c19b678db8958e142c61/docs/billing-entitlement.md"
    },
    {
      "kind": "REAL_CONSUMER",
      "result": "NOT_RUN",
      "evidence_url": "https://github.com/ajent-social/go/blob/e4ee7567048ded41fde8c19b678db8958e142c61/docs/billing-entitlement.md"
    },
    {
      "kind": "HUMAN_REVIEW",
      "result": "NOT_RUN",
      "evidence_url": "https://github.com/ajent-social/go/blob/e4ee7567048ded41fde8c19b678db8958e142c61/docs/billing-entitlement.md"
    }
  ],
  "open_questions": [
    "Human review pending; retain CANDIDATE."
  ]
}
