{
  "schema_version": 1,
  "id": "infrastructure.app-secrets",
  "name": "Application secret shells",
  "domain": "infrastructure",
  "status": "CANDIDATE",
  "disposition": "EXTRACT",
  "summary": "Secrets Manager secret metadata/ARNs without accepting plaintext values.",
  "use_when": [
    "Apps need named secret ARNs populated out of band."
  ],
  "non_goals": [
    "Password generation",
    "Automatic rotation Lambdas"
  ],
  "proposed_guarantees": [
    "No plaintext in Args",
    "Recovery window fail-closed unless explicit force delete"
  ],
  "failure_modes": [
    "Empty shells never populated",
    "Caller logs secret values elsewhere"
  ],
  "evidence": [
    {
      "visibility": "PUBLIC",
      "basis": "Original public AMSL Pulumi component; contract tests only; no live AWS apply claimed.",
      "verification": "PUBLICLY_REPRODUCIBLE",
      "url": "https://github.com/ajent-social/pulumi/tree/c668f05a2a5c274c991ec55c89a65fcdd0cede34/aws/appsecrets"
    }
  ],
  "alternatives": [
    {
      "name": "Pulumi AWS provider resources",
      "url": "https://www.pulumi.com/registry/packages/aws/",
      "assessment": "Use raw resources with policy; AMSL encodes fail-closed defaults."
    }
  ],
  "implementations": [
    {
      "url": "https://github.com/ajent-social/pulumi/tree/c668f05a2a5c274c991ec55c89a65fcdd0cede34/aws/appsecrets",
      "revision": "c668f05a2a5c274c991ec55c89a65fcdd0cede34"
    }
  ],
  "verification": [
    {
      "kind": "CONTRACT_TEST",
      "result": "PASS",
      "evidence_url": "https://github.com/ajent-social/pulumi/blob/c668f05a2a5c274c991ec55c89a65fcdd0cede34/contracts/app-secrets.md"
    },
    {
      "kind": "SECURITY_TEST",
      "result": "NOT_RUN",
      "evidence_url": "https://github.com/ajent-social/pulumi/blob/c668f05a2a5c274c991ec55c89a65fcdd0cede34/contracts/app-secrets.md"
    },
    {
      "kind": "REAL_CONSUMER",
      "result": "NOT_RUN",
      "evidence_url": "https://github.com/ajent-social/pulumi/blob/c668f05a2a5c274c991ec55c89a65fcdd0cede34/contracts/app-secrets.md"
    },
    {
      "kind": "HUMAN_REVIEW",
      "result": "NOT_RUN",
      "evidence_url": "https://github.com/ajent-social/pulumi/blob/c668f05a2a5c274c991ec55c89a65fcdd0cede34/contracts/app-secrets.md"
    }
  ],
  "open_questions": [
    "Out-of-band populate runbook before REAL_CONSUMER.",
    "Human review pending; retain CANDIDATE."
  ]
}
