{
  "schema_version": 1,
  "id": "identity.password-reset",
  "name": "Password reset",
  "domain": "identity",
  "status": "CANDIDATE",
  "disposition": "EXTRACT",
  "summary": "Consume-once password-reset tokens with TTL and notifier seam.",
  "use_when": [
    "A product needs email password recovery without building token storage."
  ],
  "non_goals": [
    "Password hashing",
    "Session minting"
  ],
  "proposed_guarantees": [
    "Token hashed at rest",
    "Single-use consume"
  ],
  "failure_modes": [
    "Token replay",
    "Logging plaintext token"
  ],
  "evidence": [
    {
      "visibility": "PUBLIC",
      "basis": "Original public CANDIDATE; behavioral boundaries informed by restricted maintainer inspection without copying private source.",
      "verification": "PUBLICLY_REPRODUCIBLE",
      "url": "https://github.com/ajent-social/go/tree/50c231b1a56cab0b857d5d82bcc8afffef25ddaf/passwordreset"
    }
  ],
  "alternatives": [
    {
      "name": "Product-local implementation",
      "url": "https://github.com/ajent-social/capabilities/blob/main/docs/rfc/0001-amsl-bootstrap.md",
      "assessment": "Extract only coordination seams; keep product policy local."
    }
  ],
  "implementations": [
    {
      "url": "https://github.com/ajent-social/go/tree/50c231b1a56cab0b857d5d82bcc8afffef25ddaf/passwordreset",
      "revision": "50c231b1a56cab0b857d5d82bcc8afffef25ddaf"
    }
  ],
  "verification": [
    {
      "kind": "CONTRACT_TEST",
      "result": "PASS",
      "evidence_url": "https://github.com/ajent-social/go/blob/50c231b1a56cab0b857d5d82bcc8afffef25ddaf/docs/password-reset.md"
    },
    {
      "kind": "SECURITY_TEST",
      "result": "NOT_RUN",
      "evidence_url": "https://github.com/ajent-social/go/blob/50c231b1a56cab0b857d5d82bcc8afffef25ddaf/docs/password-reset.md"
    },
    {
      "kind": "REAL_CONSUMER",
      "result": "NOT_RUN",
      "evidence_url": "https://github.com/ajent-social/go/blob/50c231b1a56cab0b857d5d82bcc8afffef25ddaf/docs/password-reset.md"
    },
    {
      "kind": "HUMAN_REVIEW",
      "result": "NOT_RUN",
      "evidence_url": "https://github.com/ajent-social/go/blob/50c231b1a56cab0b857d5d82bcc8afffef25ddaf/docs/password-reset.md"
    }
  ],
  "open_questions": [
    "Human review pending; retain CANDIDATE."
  ]
}
