{
  "schema_version": 1,
  "id": "identity.device-flow",
  "name": "OAuth device flow",
  "domain": "identity",
  "status": "CANDIDATE",
  "disposition": "EXTRACT",
  "summary": "RFC 8628 device authorization grant coordinator for CLI login.",
  "use_when": [
    "A CLI must authenticate against a configured OAuth device endpoint."
  ],
  "non_goals": [
    "Credential file paths",
    "Browser sessions"
  ],
  "proposed_guarantees": [
    "Configured absolute endpoints only"
  ],
  "failure_modes": [
    "Hard-coded vendor URLs",
    "Ignoring slow_down"
  ],
  "evidence": [
    {
      "visibility": "PUBLIC",
      "basis": "Original public CANDIDATE; behavioral boundaries informed by restricted maintainer inspection without copying private source.",
      "verification": "PUBLICLY_REPRODUCIBLE",
      "url": "https://github.com/ajent-social/go/tree/7ec48edc1fa9a1c14f06771b0cf3bbc3c4005001/deviceflow"
    }
  ],
  "alternatives": [
    {
      "name": "Product-local implementation",
      "url": "https://github.com/ajent-social/capabilities/blob/main/docs/rfc/0001-amsl-bootstrap.md",
      "assessment": "Extract only coordination seams; keep product policy local."
    }
  ],
  "implementations": [
    {
      "url": "https://github.com/ajent-social/go/tree/7ec48edc1fa9a1c14f06771b0cf3bbc3c4005001/deviceflow",
      "revision": "7ec48edc1fa9a1c14f06771b0cf3bbc3c4005001"
    }
  ],
  "verification": [
    {
      "kind": "CONTRACT_TEST",
      "result": "PASS",
      "evidence_url": "https://github.com/ajent-social/go/blob/7ec48edc1fa9a1c14f06771b0cf3bbc3c4005001/docs/device-flow.md"
    },
    {
      "kind": "SECURITY_TEST",
      "result": "NOT_RUN",
      "evidence_url": "https://github.com/ajent-social/go/blob/7ec48edc1fa9a1c14f06771b0cf3bbc3c4005001/docs/device-flow.md"
    },
    {
      "kind": "REAL_CONSUMER",
      "result": "NOT_RUN",
      "evidence_url": "https://github.com/ajent-social/go/blob/7ec48edc1fa9a1c14f06771b0cf3bbc3c4005001/docs/device-flow.md"
    },
    {
      "kind": "HUMAN_REVIEW",
      "result": "NOT_RUN",
      "evidence_url": "https://github.com/ajent-social/go/blob/7ec48edc1fa9a1c14f06771b0cf3bbc3c4005001/docs/device-flow.md"
    }
  ],
  "open_questions": [
    "Human review pending; retain CANDIDATE."
  ]
}
