{
  "schema_version": 1,
  "id": "infrastructure.private-database",
  "name": "Private database profile",
  "domain": "infrastructure",
  "status": "CANDIDATE",
  "disposition": "EXTRACT",
  "summary": "Specify protected database connectivity and lifecycle policy.",
  "use_when": [
    "An application needs a managed private database."
  ],
  "non_goals": [
    "Universal availability or retention defaults"
  ],
  "proposed_guarantees": [
    "Private reachability by default",
    "Explicit backup and deletion policy"
  ],
  "failure_modes": [
    "Public exposure",
    "Unverified restore procedure"
  ],
  "evidence": [
    {
      "visibility": "PUBLIC",
      "basis": "AWS RDS component CANDIDATE with PubliclyAccessible=false and managed master secret ARN; no live AWS apply claimed.",
      "verification": "PUBLICLY_REPRODUCIBLE",
      "url": "https://github.com/ajent-social/pulumi/tree/3fad4a36f3802faac1f22ee4fbd207d22e1195fc/aws/privatedatabase"
    }
  ],
  "alternatives": [
    {
      "name": "Pulumi",
      "url": "https://www.pulumi.com/docs/iac/",
      "assessment": "Use provider resources and policy checks; verify live behavior separately."
    }
  ],
  "implementations": [
    {
      "url": "https://github.com/ajent-social/pulumi/tree/3fad4a36f3802faac1f22ee4fbd207d22e1195fc/aws/privatedatabase",
      "revision": "3fad4a36f3802faac1f22ee4fbd207d22e1195fc"
    }
  ],
  "verification": [
    {
      "kind": "CONTRACT_TEST",
      "result": "PASS",
      "evidence_url": "https://github.com/ajent-social/pulumi/blob/3fad4a36f3802faac1f22ee4fbd207d22e1195fc/contracts/private-database.md"
    },
    {
      "kind": "SECURITY_TEST",
      "result": "NOT_RUN",
      "evidence_url": "https://github.com/ajent-social/pulumi/blob/3fad4a36f3802faac1f22ee4fbd207d22e1195fc/contracts/private-database.md"
    },
    {
      "kind": "REAL_CONSUMER",
      "result": "NOT_RUN",
      "evidence_url": "https://github.com/ajent-social/pulumi/blob/3fad4a36f3802faac1f22ee4fbd207d22e1195fc/contracts/private-database.md"
    },
    {
      "kind": "HUMAN_REVIEW",
      "result": "NOT_RUN",
      "evidence_url": "https://github.com/ajent-social/pulumi/blob/3fad4a36f3802faac1f22ee4fbd207d22e1195fc/contracts/private-database.md"
    }
  ],
  "open_questions": [
    "Restore drill evidence before claiming recoverability.",
    "Human review pending; retain CANDIDATE."
  ]
}
